{"baseline": {"branch": "main", "initial_status_lines": 113, "starting_commit": "9a19d488746541b59ef92874ebc1a58a4bd95c36", "this_run_baseline_file": ".hm-orchestrator/runs/20260917T171532Z-1c371707/BASELINE_STATUS.txt", "true_mission_baseline": ".hm-orchestrator/runs/20260916T184200Z-dd1e00e6/BASELINE_STATUS.txt + BASELINE_DIFF.patch (original run); mission changes = current tree minus that baseline", "unrelated_work_preserved": true, "unrelated_work_note": "money/billing/affiliate modules, system_brain_payments, invariant money/cancellation/unfinished-attempts tests and orchestrator bookkeeping were already changed before the mission and were never touched"}, "changed_files": [{"areas": "provider endpoint/key/header owner for a model id; shared Responses text reader; is_configured", "behavior": "active features route to OpenCode Go Muse; stale gpt requests byte-identical", "file": "src/ai_market_monitor/services/ai_provider.py", "finding": "none", "pre_existing_user_changes": false, "risk": "low", "why": "new: one owner for provider routing (R9)"}, {"areas": "OPENCODE_GO_API_KEY, OPENCODE_GO_BASE_URL, model/effort/budget defaults, Muse pricing entry", "behavior": "active defaults are Muse/high with resized budgets", "file": "src/ai_market_monitor/core/config.py", "finding": "none", "pre_existing_user_changes": false, "risk": "medium", "why": "R10/R12/R13 settings and defaults"}, {"areas": "startup gate reads is_configured owner", "behavior": "missing OpenCode Go key refuses boot for active features", "file": "src/ai_market_monitor/core/startup.py", "finding": "none", "pre_existing_user_changes": false, "risk": "medium", "why": "R11 startup validation"}, {"areas": "OpenAIAgentResponsesClient via ai_provider; session_key per conversation", "behavior": "shared client serves Muse; stale callers unchanged", "file": "src/ai_market_monitor/services/agent_control.py", "finding": "none", "pre_existing_user_changes": false, "risk": "medium", "why": "R2-R5 shared client move (WP3)"}, {"areas": "configured checks via is_configured", "behavior": "active features need OpenCode Go key, not OpenAI key", "file": "src/ai_market_monitor/services/agent_policy.py", "finding": "none", "pre_existing_user_changes": false, "risk": "low", "why": "R11 configured checks"}, {"areas": "structured_call via ai_provider; incomplete-status error; tier no-op for OpenCode Go", "behavior": "truncation reported as its own error; no service_tier sent to Go", "file": "src/ai_market_monitor/services/openai_structured_call.py", "finding": "none", "pre_existing_user_changes": false, "risk": "medium", "why": "R12 + shared client move"}, {"areas": "new key is a credential field", "behavior": "key treated as secret everywhere", "file": "src/ai_market_monitor/services/provider_credentials.py", "finding": "none", "pre_existing_user_changes": false, "risk": "low", "why": "R14 secrets"}, {"areas": "redaction patterns include new key", "behavior": "new key redacted in logs/labels/review", "file": "src/ai_market_monitor/services/security_review.py", "finding": "none", "pre_existing_user_changes": false, "risk": "low", "why": "R14 secrets"}, {"areas": "model_for_turn via owner; no openai_model fallback", "behavior": "Hilal answers via Muse/high", "file": "src/ai_market_monitor/services/hilal_chat_agent.py", "finding": "none", "pre_existing_user_changes": false, "risk": "medium", "why": "R3 + prompt rules for new records (R20)"}, {"areas": "typed view/board/account/passport/methodology sections; _fit_to_size drops passports, cards, checklist, monitors; trimmed flag only on real drops", "behavior": "payload bounded at 30000 chars, never raises", "file": "src/ai_market_monitor/services/hilal_chat_knowledge.py", "finding": "logic major + minor fixed this run (fix + test)", "pre_existing_user_changes": false, "risk": "medium", "why": "R15-R21 Hilal evidence"}, {"areas": "ask() passes user_id + session_key=str(conversation.id)", "behavior": "per-user records; conversation-bound provider session", "file": "src/ai_market_monitor/services/hilal_chat.py", "finding": "none", "pre_existing_user_changes": false, "risk": "medium", "why": "R17 + session_key} (B1 fix from original run)"}, {"areas": "HilalChatView/PageContext/BoardCard inputs + caps", "behavior": "typed bounded payload contract", "file": "src/ai_market_monitor/schemas/hilal_chat.py", "finding": "none", "pre_existing_user_changes": false, "risk": "low", "why": "R16/R21 schema"}, {"areas": "ACCEPTED page set; truncatePageNote coerces strings; truncateBoard caps", "behavior": "pages publish own words; over-long truncated never refused", "file": "src/ai_market_monitor/static/hm-page-context.js", "finding": "logic minor fixed this run (fix + test)", "pre_existing_user_changes": false, "risk": "low", "why": "R15/R21 page context"}, {"areas": "closed per-page publish() calls incl. board publisher", "behavior": "each page describes itself, data-only, no visible UI", "file": "src/ai_market_monitor/static/hm-*-test.js (9 files) + hm-page-notes.js + hm-research-test.js (new)", "finding": "none (hm-research-test.js double publish is harmless Map replace, noted)", "pre_existing_user_changes": false, "risk": "low", "why": "R15 page publishers"}, {"areas": "configured checks via owner", "behavior": "correct not-configured signal", "file": "src/ai_market_monitor/api/routers/public.py + dashboard_api.py", "finding": "none", "pre_existing_user_changes": true, "risk": "low", "why": "R11 router checks (dashboard_api _explainer_model hunk is unrelated prior work, preserved)"}, {"areas": "new keys in examples; real files hold copied keys + budgets + cap", "behavior": "four files agree; counts-only proofs recorded", "file": ".env.example + .env.production.example (+ .env + .env.production, gitignored)", "finding": "none", "pre_existing_user_changes": false, "risk": "medium", "why": "R10/R12/R21 settings"}, {"areas": "R2-R6 + R12 invariants; R15-R21 chat/page/passport/cap tests; browser e2e; conftest", "behavior": "rule-level parametrised proof", "file": "tests/unit/test_invariant_ai_provider.py + test_invariant_active_provider.py + test_invariant_hilal_page_context.py + test_reliability_security.py + test_system_brain_*.py + tests/integration/test_hilal_chat_evidence.py + test_public_chat_api.py + tests/browser/test_hilal_page_context_e2e.py + tests/conftest.py", "finding": "none", "pre_existing_user_changes": false, "risk": "low", "why": "acceptance tests (3 new invariant files + browser file are new)"}, {"areas": "research templates (data hooks only)", "behavior": "no visual change", "file": "src/ai_market_monitor/templates/hilal/dashboard_test/research.html + research_detail.html", "finding": "none", "pre_existing_user_changes": false, "risk": "low", "why": "R15 page data hooks"}, {"areas": "public chat + support via owner; dossier both paths + tier no-op; discovery model switch only", "behavior": "all active paths on Muse/high; discovery flag unchanged", "file": "src/ai_market_monitor/services/public_chat.py + public_support_ai.py + sharia_research.py + sharia_source_ai_discovery.py + system_brain_agent.py + system_brain_assistant.py", "finding": "none", "pre_existing_user_changes": false, "risk": "medium", "why": "R2/R4/R5/R6 active moves"}], "diff_audit": {"broad_catch_or_fallback": "none introduced; silent OpenAI fallback removed for active features; unknown model refused (fail closed)", "dead_code": "none introduced", "duplicated_parser_or_rule": "none introduced; shared owner added (ai_provider) and active _output_text copies use one reader", "final_changed_files": "47 mission entries (current status minus original baseline): list in changed_files ledger", "fix_hunks_this_run": "hilal_chat_knowledge.py _fit_to_size ordering + trimmed flag; hm-page-context.js string coercion; +4 reproducer tests (all fail-before proven)", "generated_files": ".hm-orchestrator/runs/20260917T171532Z-1c371707/junit.xml (required evidence)", "git_diff_check": "clean (only CRLF warnings, no whitespace errors)", "risky_excerpts": "_fit_to_size drops whole card/checklist/monitor rows last-first when over cap (by design, tested); deliverable_channels(user_id=...) scoping (tested cross-user)", "todo_fixme_debug_prints": "none left", "unexpected_files": "none; stale family absent from diff (R8 PASS, double-checked by final adversarial review)"}, "final_verdict": "COMPLETE_VERIFIED", "hidden_error_audit": {"accessibility": "not relevant (no visual UI added; page publishers data-only)", "async_concurrency_race": "relevant, evidence: agent tool loop handles message+function_call items and ignores reasoning items on resend (tested, live R5 loop green)", "auth_permissions": "relevant, evidence: router requires authenticated User; user_id from principal, never caller-supplied (reviewed, tested R17)", "backward_compatibility": "relevant, evidence: stale gpt requests byte-identical; schema validators mode=before clip (tested)", "billing_entitlements": "not relevant (plan read-only for Hilal account section; unrelated billing work untouched)", "caching_state_invalidation": "not relevant", "error_exception_paths": "relevant, evidence: incomplete/max_output_tokens is its own error; over-cap truncates never raises (tested)", "frontend_backend_mismatch": "relevant, evidence: JS caps == schema caps parametrised test (7 caps); string-note coercion (tested)", "performance_regression": "relevant, evidence: payload capped 30000 chars; measured turn latencies 12-17 s recorded", "request_response_shape": "relevant, evidence: Responses body without output_text handled by one reader; json_schema strict tool loop verified live", "save_edit_reload_roundtrip": "not relevant (no persistence changed)", "schema_database_migration": "not relevant (no migration touched; single-head rule unaffected)", "secrets_privacy": "relevant, evidence: new key in CREDENTIAL_FIELDS + redaction + security review (tested); training-enabled non-ZDR model disclosed; counts-only env proofs, no value